,text,sentiment
21098,".с.,и спросил его:  о Посланник Аллаха!Ты порицаешь что-то из слушания?  Он ответил: я не порицаю ничего из него,но передай им,чтобы они открывали свои собрания Кораном и закрывали их Кораном ...........Это дошедшие до нас мнения и тот кто находится в поисках истины,по мере изучения этого вопроса будет сталкиваться с разногласиями и будет оставаться в растерянности или склонится к мнению одной из сторон по своему желанию.Но всего этого недостаточно,потому что он сам должен найти истину,подробно изучив вопросы запретного и разрешённого.|||||||||||||||||||||||||||||||||||||Обрати внимание:основатели всех четырёх мазхабов осуждали песни и поэззию.И этим часто грешат заблудшие суфии.Исключение делается для исламской тематики  Сахих БухариО проявлении радости во время праздника.498 (949). Сообщается, что ‘Аиша, да будет доволен ею Аллах, сказала: (Однажды) посланник Аллаха, да благословит его Аллах и приветствует, вошёл ко мне в то время, когда у меня находились две девушки, певшие песню о Бу‘асе1, лёг на постель и отвернулся. (А через некоторое время в мою комнату) вошёл Абу Бакр и резко спросил меня: “(Как может) свирель шайтана (звучать) у пророка, да благословит его Аллах и приветствует?!” Тогда посланник Аллаха, да благословит его Аллах и приветствует, повернулся к нему и сказал: “Оставь их”,2 когда же (Абу Бакр) отвлёкся, я сделала девушкам знак и они вышли .________________________________________1 Бу‘ас — название урочища в двух милях от Медины, где в 619 или 620 году произошло сражение между отрядами племён аус и хазрадж, в котором победили ауситы и погибло много людей, после чего эти племена в течение определённого времени враждовали друг с другом",1
32638,"В Алматинском метрополитене открылась  фотовыставка «Путь Лидера», посвященная Дню первого Президента, который страна отметит 1 декабря, а также пятилетнему юбилею открытия первого метрополитена в Казахстане. 25 фотографий Елбасы разместились на одной из станций алматинского метро, передает корреспондент. Событие приурочено Дню Первого Президента Республики Казахстан и 5-летнему юбилею метрополитена г. Алматы.  «Эта выставка проводится практически каждый год, однако особенность ее в этом  году в том, что она приурочена не только ко Дню первого Президента и 25-летию независимости, но и 5-летию нашего метрополитена. В этом году архив Президента предоставил нам символичное количество фотографий – на выставке разместились 25 фотографий Елбасы с молодежью нашей страны в разный период, начиная с 2002 года. Мы знаем, что Нурсултан Абишевич огромное внимание уделяет молодежной политике, тем самым мы хотели подчеркнуть, что подрастающее поколение играет ключевую роль в становлении нашей страны», - отметила директор государственного фонда развития молодежной политики Алматы  Алма Ауганбаева. Торжественную церемонию открытия посетили заместитель директора Алматинского метрополитена Куаныш Кантаев и представитель архива Президента РК Бахытхан Шайлазымов.  Выставка размещена на станции метрополитена «Сайран». Здесь представлены снимки Нурсултана Назарбаева с молодежью страны в разные годы своей деятельности.    Творческую коллекцию дополнили и лучшие работы молодых талантливых художников детских клубов города, посвященные 5-летию городского метро.  Также сегодня в честь открытия фотовыставки гостей и жителей города Алматы ожидал приятный сюрприз – профессиональные художники поделились секретами своего ремесла с пассажирами и организовали для самых маленьких посетителей серию мастер-классов.  «Я пришла сюда со своей пятилетней дочкой. Очень радует, что сегодня организовали такой праздник. Детям очень нравится заниматься изготовлением подделок, рисовать, лепить и клеить. Такие мероприятия позволяют привить в них любовь к искусству», - поделилась гостья открытия фотовыставки Гульназ Сагымбаева.  В честь торжества  концертная программа была подготовлена студентами из Казахской национальной академии искусств им. Т.К.Жургенова. Ребята исполнили  любимые песни Нурсултана Абишевича Назарбаева и продемонстрировали свое творчество.  Добавим, выставка «Путь Лидера» будет размещена на станции «Сайран» до 2 декабря.  Между тем, в это же время вузах города будет работать мобильная, или переездная, фотовыставка. ",0
32639,"Удивлена крайними плохими отзвами. Мне отель очень понравился. Но может за пол года так резко изменился...Отель тихий, спокойный, всегда приветливый и улыбчивый персонал. При заезде депозит 100$. При выезде вернули без проблем, ничего не приписали. Номер был на 3 этаже, в самом далеке, что для меня было только плюсом - никто не ходил, не шумел. Про бассейн скажу что есть, но я в него не погружалась, я к морю как-то больше приезжала. Wi-Fi на всей территории, хотя чем дальше от ресепшен, тем хуже сигнал. Бесплатно, в номере тоже. Пароль менялся каждые 3 дня. Без проблем получала новый на ресепшен.В номере была большая кровать и софа, вполне себе доп место, ребенок спокойно может спать. Телевизор (да, старенький, но я его смотрела утром максимум час и вечером где-то столько же), сейф, холодильник, на балконе столик, 2 креслица и сушилка для белья. В ванной именно ванна, а не душ (для меня прям плюс). В шкафу 2 зонтика, 2 халата, тапочки, сумка для пляжа, 2 пляжных полотенца. Кстати, жила одна, но все ложили по 2, и мыльно-рыльное, и полотенца, и воду. Дня 3 искала фен, перерыла все ящики, нашла только после подсказок девушки с ресепшен. Был в шкафу, в ящике под сейфом. Вроде просто, но при выезде, оказалась, что не одна его искала, но нашла только я)))Постельное белье беленькое, чистое, без пятен, хотя внурь не лезла, подушки и одеяло из него не доставала, не на столько я придирчива. Перед поезкой покрасила волосы, в первую же ночь слегка замарала наволочку. Думала, вычтут из депозита. Но нет, белье поменяли и все. В номере убирались регулярно, каждый день. Так как я маленькая свинка уборка была более чем заметна. Всегда оставляла 20 батт в номере.Завтраки с видом на море бесподобны. Можно было сесть за столик на веранде и любоваться. Кто пишет про однообразность завтраков - люди, что вы едите дома???? Прям все такие разнообразно-разнообразные. Хорошие завтраки, было из чего выбрать. Перепробывала почти все предлагаемые блюда и выбрала для себя самые-самые. Всегда были фрукты, из них делала себе фруктовый салат, заправляла йогуртом.Море прямо через дорогу. Пляж чистый, видно, что убирают. Песок хрустит под ногами, как снег. Можно взять зонтик, матрас (за плату). Волны в море очень сильные, первые пару дней только ноги мочила. Потом вроде волны слегка подуспокоились и я смогла накупаться. Хотя может кому-то и не принципиально спокойное море, я просто очень боюсь нырять и поэтому не сильно люблю, когда накрывает волной с головой. Движение на дороге между морем и отелем не оживленное, но если что от отеля стоит человек, помогает перейти дорогу. Тоже всегда улыбался)) Вообще, Тайланд действительно страна улыбок. Главное не дуть губы и не смотреть на всех с высоты. Как вы к людям, так и они к вам.Рядом есть 7-11, если пройтись вправо-влево магазинчики, ресторанчики, обменники, ""макашницы"", бары видела в стороне от отеля, надо пройтись.Вобщем, если вам, как мне, нужны батонный отдых на пляже, тишина, покой и море, то очень хорошее место. Если поеду снова на этот пляж, то только в этот отель. Но если вам хочется погулять, покуражиться, пошопится - то тут, я думаю, вы заскучаете.",1
32640,"14 декабря 2013 г. праздновали юбилей мужа .  Остались очень довольны .  Замечательная кухня , хорошая организация банкета , красивая подача , внимательное отношение , улябающиея тактичные официанты , приятное музыкальное сопровождение .  Большое всем спасибо !  С удовольствием будем заходить еще !  ",2
32641,"Отличный отель, главное - хорошее расположение - 3 минуты от входа в Центральный жд вокзал, а значит - все доступно очень быстро.Персонал адекватный. Есть камера хранения, причем реально камера, а не просто в подсобке чемодан ставят. Вай-фай в номерах. Номера небольшие, душевые маленькие, обогрев комнат - кондицонер (небольшой минус - шумит ночью). Завтрак умеренный, например, яйца были лишь раз (и то вареные), остальное - классический холодный буфет. Еще один минус - поскольку это недорогой отель, то много школьников тут останавливаются, а они, как и все дети - шумноваты - с этим приходится мириться во время завтраков.",1
32642,ОТКУДА У НЕГО В КОММЕНТАРИЯХ СТОЛЬКО СОВКОВ БЛЯДЬ Я НЕ ОДОБРЯЮ КРИТИКУ ЛЕВАЧЕСТВА. ,2
32643,"Конечно, далеко не ангел и отнюдь не бескорыстный  прораб перестройки (ТМ). Да,  причин  целое море. Например, кто знает, что ждало бы Березовского через 3 дня (после кипрского дефолта). Какой Александр Полоньевич решил опередить события?Ещё одна странность: не успели на Эхе обсудить яхту Романа Абрамовича, как пришла пора озвучить новость о смерти Бориса Абрамовича. И как только дикторы не путаются в ударениях!Но главное: кто следующий?  Ну если уже в Кремле траур по Бориске, то всё! Тушите свет!)))  :-)  Принимая во внимание, что буквально на днях утонул на Бали в бассейне метр глубиной художник Монро, собиравшийся ставить с Лондоне спектакль  Полоний , начинаешь думать, что свет выключали и раньше. )",0
32644,"           Скажу сразу по соотношению цена-качества идеальный автомобиль, да, не мерседес, но исходя из этого понимания можно объективно выделить плюсы и минусы. Итак: продав мазду 3, приобрела круз в октябре 2011 года, у знакомого, он его купил в салоне в мае 2011. Успел затонировать и установить парктроник (задний), про него ниже, поставить резину 17 радиуса (про нее тоже отдельно), поменял музыку на MP3. Комплектация минимальна (базовая). Объем - 1,6. АКПП. Стоимость 590 тыс. Пробег был около 3000. Состояние идеальное, нового автомобиля. Плюсы: - однозначно стоимость, долго мониторила ценовую категорию 550 - 650 000, рассматривала и пежо, ситроен, киа, но круз, явно на их фоне явно выигрывал;- просторный салон, действительно в салоне, даже при полной посадке пассажиров, места достаточно, никто никому не мешает. - вместительный багажник, единственно мешают не очень удачные стойки-держатели, полной загрузке багажника упираются в багаж, невозможно закрыть.- для меня лично однозначный плюс (касаемо удобства) - это сиденья, очееень удобные, садишься и получаешь удовольствие. Попадаешь в как бы углубление, по бокам сиденье ""обхватывает"", по крайней мере, при интенсивном эксплуатировании (пробки и т.д.) спина ни разу не пожаловалась.- В принципе удачный дизайн внутри, все достаточно удобно, под ""рукой"", особо выделить нечего, пластик недорогой, но главное удобство.- общий дизайн автомобиля, смотрится достаточно внушительно и достойно;- на трассе идет хорошо, ""не тошнит"" от недостаточной мощности (все таки 1.6.), но только когда уже за 100 км/ч.- расход, соответствует заявляемому дилерами, по городу где-то 9-10, трассу не контролировала, но думаю, что в пределах разумного.- недорогое обслуживание - принципиально не обслуживаюсь у официалов, за первое ТО попросили около 9000, это не просто завышено, это они офигели. У хорошего друга вполне приличный автосервис, мой круз там вылизывают по полной программе, в итоге выходит дешевле ровно в 3 раза, чем у диллеров.Минусы:- до круза ездила на мазде 3, поэтому волей-неволей сравниваю с ней. Для движка 1.6. машина явно тяжеловата, не хватает совсем чуток мощности (у отца 1.8. - там все в порядке с этим). При наборе скорости (даже с тапкой в пол) едет неохотно, на разгон нужно время, но разогнавшись едет достаточно прытко. Хотя на светофорах еще не было прецедентов бибиканья из-за туговатого троганья, при умении можно и всех сделать))).Для меня один из самых больших минусов и бед -это подъемы, крайне плохо едет в горку, причем любую (эстакада, мост, просто подъем), оооочень тяжело. Заметила это с первого же дня, для себя отметила, свыклась, но иногда раздражает.- задние колодки при заднем ходе, на всех форумах обсуждают эту беду круза - свистят. Подтверждаю, есть такое. Мои начали свистеть, где-то месяце через 5 после покупки, поменяла, ничего не изменилось. Махнула рукой... И незаметно, не могу идентифицировать отчего и когда, свистеть прекратили, пока т-т-т тишина)))- не советую машину людям не чувствующим габариты, машина большая, привыкнуть невозможно. Наверно не посоветую девушкам и женщинам (не в обиду), но это чаще женская болезнь - габариты. Сама слава богу не болею, но есть такое.- у моего круза болезнь- это свет, уже 3 раза меняла пары лампочек передних фар, перегорают и все, лампочки и дорогие и дешевые, по барабану -перегорают. В сервисе разводят руками, индивидуальная болезнь автомобиля(- и еще подтверждаю отзывы в интернете - достаточно сильно запотевает лобовое стекло, лечится кондиционером по полной.- нужно признать шумный (но с учетом понимания, что это не мерседес - не критично)- и чисто женское - сиденья быстро пачкаются (с учетом наличия 3-х летнего разбойника) - катастрофа, уже делала химчистку, видимо предстоит еще одна. Остальные минусы комплектации - нет подогрева сидений (купила работающий от прикуривателя), стеклоподъемники только спереди (мне достаточно), не климат, а кондиционер, но все решается с покупкой комплектации LS или LT. или установкой доп.оборудования.По поводу советов:1. Однозначно задние парктроники рулят, до этого ни на одной машине у меня их не было, но на круз они действительно нужны, задний обзор не очень.2. Предыдущий хозяин снял 16 радиус, и поставил 17. Я скажу этому однозначное -ДА! Так называемая шумка ощутимо меньше, машина в разы лучше держит дорогу, входит в повороты (ездила на 16, разница действительно колоссальная). Единственный минус - 17 радиус, не для наших дорог, за год диски убились насмерть, требуют прокатки все 4, при этом я достаточно аккуратно езжу, ямы не собираю, но приходится часто бывать в Московской области, а там...грустно. Сейчас пробег 32 тыс с копейками, т-т-т, кроме свистящих колодок, ну и света ничем не огорчил, в сравнении с той же маздой проигрывает, но мазда и других денег стоит.  Машина на твердую, хорошую четверку. Со своими плюсами и минусами, но на вопрос брать или нет (за такую стоимость), однозначно скажу - брать, в своей ценовой категории лучший, по всем показателям.  ",0
32645,"Все хорошо, вот только есть в этой статье одна ошибка. Крайне мала не вероятность, а возможность. ",0